minute_id,date,year,institution,keyword,context_snippet,is_climate_change,raw_response
171,2022-10-04,,Reserve Bank of Australia,climate change,"f a decline in
						lending standards, it was important that lending standards remained prudent.
Finally, members discussed the Bank’s ongoing involvement in work streams addressing the financial
						stability risks associated with cybercrime and climate change. The recent cyber-attack on Optus
						underscored the importance of organisations having effective cyber resilience and recovery plans. In
						conjunction with other agencies comprising the Council of Financial Regulators, the Bank had participa",True,Yes
171,2022-10-04,,Reserve Bank of Australia,green finance," of climate change and associated policies, including the modelling of
						physical and transition risks and scenario analysis. In addition, the Bank continued to engage in
						international forums on the development of consistent standards for ‘green finance’ and the
						reporting of climate-related disclosures, which was relevant to its ongoing analysis of the cost and
						availability of finance in Australia.
Considerations for monetary policy
In considering the policy decision, members noted that",True,Yes
171,2022-10-04,,Reserve Bank of Australia,transition risk,"ons to navigate
						significant cyber-related disruptions. The Bank also continued to progress work on the economic and
						financial stability implications of climate change and associated policies, including the modelling of
						physical and transition risks and scenario analysis. In addition, the Bank continued to engage in
						international forums on the development of consistent standards for ‘green finance’ and the
						reporting of climate-related disclosures, which was relevant to its ongoing ",True,Yes
171,2022-10-04,,Reserve Bank of Australia,coal,"e packages had lowered
						the expected near-term peaks in headline inflation stemming from higher energy costs, the scale of the UK
						fiscal stimulus was expected to add to inflationary pressures over the medium term.
European gas and thermal coal prices had fallen significantly over the prior month owing to the commitment
						to implement energy rationing and the imposition of a windfall tax on non-gas energy generation,
						including from coal. Nevertheless, prices remained many times h",False,No
172,2022-09-06,,Reserve Bank of Australia,coal,"n
						were exacerbating the outlook for steel production, which had already been constrained by government
						production caps. Iron ore prices had declined towards the bottom of their range over the past two years.
					
Members noted that high coal and gas prices were supporting Australia’s terms of trade at record
						levels. In contrast to other energy commodities, crude oil prices were well below their peaks following
						Russia’s invasion of Ukraine. This decline reflected concerns abo",False,No
173,2022-08-02,,Reserve Bank of Australia,climate change,"ance, such as private equity and non-bank finance, although these sources of funds remained
						modest compared with bank lending.
Members discussed recent developments in the management of climate-related financial risks. They observed
						that climate change and other sustainability considerations have become more prominent in the decisions
						of investors and that there is potential for climate-risk considerations to influence the cost and
						availability of financing for Australian entities. The",True,Yes
173,2022-08-02,,Reserve Bank of Australia,coal,"					higher interest rates dampened demand.
Members observed that many non-energy commodity prices had declined as the global growth outlook was
						revised lower, and were back around their levels at the beginning of the year. Iron ore and coking coal
						prices had fallen since mid-June, reflecting increased concerns about the outlook for the Chinese
						property market. Oil prices had also been lower over this period. By contrast, gas and thermal coal
						prices had risen owing to develop",False,No
175,2022-06-07,,Reserve Bank of Australia,coal,"atile. Limited spare capacity in global oil refining at a
						time of strengthening demand had boosted refinery margins, in turn feeding into higher retail fuel
						prices. Global gas prices had eased from peaks earlier in the year while thermal coal prices had
						increased further, reflecting a boycott of Russian coal by some countries and the substitution of gas
						with coal by electricity producers in Asia. Agricultural commodity prices had also increased,
						particularly wheat as di",False,No
177,2022-04-05,,Reserve Bank of Australia,coal,"kraine are likely to be material, but
						difficult to predict.
The effect of the invasion of Ukraine on commodities markets had been most pronounced in energy,
						reflecting Russia's role as a significant supplier of natural gas, crude oil and coal. Higher energy
						prices had raised costs for transport, electricity, base metals and other energy-intensive production. In
						addition, the invasion had disrupted global food supplies as Russia and Ukraine are significant producers
						of w",False,No
180,2023-12-05,,Reserve Bank of Australia,coal,"operty developers.
Nonetheless, the continued positive information about the Chinese economy outside the property sector had
						supported iron ore prices, which had increased a little over the prior month and remained at high levels.
						Coking coal prices had fallen as supply disruptions in Australia had been resolved. Oil and gas prices
						had declined further over the prior month, as demand had eased in line with slower global growth and amid
						signs that the Hamas–Israel conflict see",False,No
180,2023-12-05,,Reserve Bank of Australia,oil and gas,"Chinese economy outside the property sector had
						supported iron ore prices, which had increased a little over the prior month and remained at high levels.
						Coking coal prices had fallen as supply disruptions in Australia had been resolved. Oil and gas prices
						had declined further over the prior month, as demand had eased in line with slower global growth and amid
						signs that the Hamas–Israel conflict seemed not to be spreading more widely
						across the region. Oil prices were around ",False,No
182,2023-10-03,,Reserve Bank of Australia,climate change,"from outside the financial system. Such threats include
						cyber-attacks, the potential for an escalation in geopolitical tensions that cause severe disruptions to
						trade and international capital flows, and the effects of, and responses to, climate change.
Considerations for monetary policy
In turning to the policy decision, members noted that inflation remained well above target and was
						expected to do so for some time. Services price inflation remained sticky, and fuel prices were adding to
		",True,Yes
182,2023-10-03,,Reserve Bank of Australia,coal,"key risk to the global outlook.
Despite the weakness in the property sector, Chinese steel demand had been resilient owing to ongoing
						demand from infrastructure and manufacturing investment. This had helped to support iron ore and coking
						coal prices. Coking coal prices had also benefited from solid demand from India and some supply
						disruptions in Australia.
Domestic economic conditions
Turning to the domestic economy, members noted that inflation had continued to moderate from its ",False,No
184,2023-08-01,,Reserve Bank of Australia,coal,"ent of the shift was
						uncertain, and authorities continued to emphasise the containment of risks. Iron ore prices had increased
						in response to an expectation of further targeted stimulus for the property sector. By contrast, thermal
						coal prices had declined, partly because of weak industrial demand in China.
Members observed that growth in Australia’s major trading partners was expected to be lower than
						forecast in May, at around 3¼ per cent in 2023 and 3 per cent in 2024 – we",False,no
186,2023-06-06,,Reserve Bank of Australia,coal,"for global growth had led to falls in a range of
						commodity prices since the start of the year. Bulk commodity prices had declined and were now close to
						pre-pandemic levels. Prices of energy commodities had declined the most, with thermal coal and spot
						prices for liquified natural gas falling in response to relatively high levels of inventories and broader
						concerns about the outlook for growth. Oil prices had also fallen. If sustained, these declines would
						further dampen",False,No
187,2023-05-02,,Reserve Bank of Australia,coal,"thening. Housing demand had increased, with new sales well above their recent trough and prices for
						new housing rising in most cities. Despite this, concerns about the outlook for Chinese steel production
						had affected iron ore and coking coal prices received by Australian exporters over the preceding month.
						Global oil and gas prices had also fallen during April.
Domestic economic conditions
Turning to the domestic economy, members noted that inflation had eased in the March quarter",False,No
187,2023-05-02,,Reserve Bank of Australia,oil and gas," and prices for
						new housing rising in most cities. Despite this, concerns about the outlook for Chinese steel production
						had affected iron ore and coking coal prices received by Australian exporters over the preceding month.
						Global oil and gas prices had also fallen during April.
Domestic economic conditions
Turning to the domestic economy, members noted that inflation had eased in the March quarter, confirming
						the staff assessment that inflation had passed its peak. Despite this, i",False,No
188,2023-04-04,,Reserve Bank of Australia,coal,"uncement by the Organization of the
						Petroleum Exporting Countries in early April of forthcoming production cuts; oil prices remained around
						30 per cent below their peak level following Russia’s invasion of Ukraine in February
						2022. Coal and gas prices had also declined, but they remained well above levels that had prevailed in
						the years prior to the invasion. The iron ore price had declined a little and base metals prices had been
						broadly stable.
Domestic economic devel",False,No
189,2023-03-07,,Reserve Bank of Australia,coal,"olicy priorities of Chinese policymakers for the
						coming year, which included a growth target of 5 per cent and a headline general government
						deficit of 3 per cent.
The stronger outlook for Chinese demand had supported iron ore and coking coal prices owing to the more
						positive outlook for Chinese steel production. Coking coal prices had increased further in February to be
						back in line with thermal coal prices, although this partly reflected supply disruptions in Queensland.
		",False,No
190,2023-02-07,,Reserve Bank of Australia,coal,"sures would support activity in the property sector, which had been very
						weak.
The earlier reopening and other policy shifts in China had also led to expectations for higher steel
						production, and had lifted prices for iron ore and coking coal. These increases stood in contrast with
						the developments in most other commodity prices, which were below their recent peaks. Gas prices and
						thermal coal prices were sharply lower than a few months earlier, partly because favourable wint",False,No
192,2024-05-07,,Reserve Bank of Australia,coal,"le to a
						rise in net exports. Members noted, however, that conditions in the property market remained very weak
						and that policy support would still be needed to offset the resulting drag on GDP growth. The prices of
						iron ore, coking coal and base metals had all risen since the previous meeting, due to some combination
						of a stronger economic outlook for China and constrained supply. The staff forecast for trade-weighted
						growth in Australia’s major trading partners had bee",False,No
194,2024-02-06,,Reserve Bank of Australia,coal,"ly offset by continued
						strength in manufacturing investment and further policy support for infrastructure investment. Additional
						policy measures had supported Chinese steel production and, in turn, the prices of iron ore and coking
						coal received by Australian exporters.
Domestic economic conditions
Members observed that inflation in Australia had moderated, with both headline and underlying inflation
						lower in the December quarter 2023 than had been expected three months prior",False,No
201,2023-09-20,,Bank of Canada,oil and gas,"They noted that special factors such as volatility in aircraft imports can have an outsized impact on business investment data. One-off factors held back output in the second quarter. These factors included wildfires, which particularly affected the oil and gas and mining sectors and reduced economic growth by around 0.5 percentage points. As well, strikes in the public sector were estimated to have lowered quarterly growth by about 0.25 percentage points.
The Governing Council also discussed the housing s",False,No
219,1998-05-22,,Bank of Japan,coal," a 2-trillion yen special income tax reduction. Furthermore, the government was discussing the implementation of drastic measures as necessary, attaching importance to the outline of the comprehensive economic stimulus package drawn up by the ruling coalition parties in late March.
(3) The government was taking various measures to address the financial system problem and the cautious lending attitude of financial institutions. It was important that the Bank of Japan, for its part, should reduce fina",False,No
220,1998-04-30,,Bank of Japan,coal," of economic measures implemented by the government, such as the supplementary budget for fiscal 1997, which included a special income tax reduction, and the financial system stabilization measures.  The representative also explained that the ruling coalition parties were discussing the possible implementation of additional economic stimulus packages.  Further, the member reported that the government was giving top priority to the early passage of the fiscal 1998 budget and its smooth implementation",False,no
248,2000-11-22,,Bank of Japan,coal,"ould slow considerably in the future and the yen's real effective exchange rate was rising.  Fourth, it was likely that Japan's wholesale price indexes would decline year on year in fiscal 2001 when the effects of the rise in prices of petroleum and coal products would subside.  And fifth, the downward trend of the consumer price index (CPI) was expected to continue for a while because of the continuing decline in the cost of rented accommodation reflecting the deterioration of the supply and demand",False,No
311,2005-01-24,,Bank of Japan,coal,"ces (1995 base), as well as domestic corporate goods prices, were increasing year on year.  One member said that prices of steel plates were forecasted to rise further in fiscal 2005 due to the surge in shipping charges and the increase in prices of coal and iron ore.  Moreover, this member expressed the view that there was less room than in the past for further absorbing the rise in costs through higher productivity.  Therefore, firms might have to decide at some point in the future whether they wo",False,No
331,2005-10-17,,Bank of Japan,oil and gas,"ation rate continued to be on a moderate but steady rising trend from a longer-term perspective.  The effects of the hurricane in late August on the U.S. economy were difficult to estimate at this point, but a possible prolonged period of high crude oil and gasoline prices and the potential negative effects on consumer and business confidence were cause for concern.
The euro area economy remained sluggish, although exports were picking up partly due to depreciation of the euro.
With regard to East Asian ec",False,No
528,2020-06-19,,Bank of Japan,coal,"uction, exports, private consumption, and fixed asset investment had started to pick up from a large decline that reflected the impact of the spread. Economic activity seemed to be picking up when looking at high-frequency data such as the amount of coal consumption -- a manufacturing-related indicator -- and the traffic congestion index of Chinese cities -- a nonmanufacturing-related indicator.
The European economy had become depressed rapidly due to the impact of the spread of COVID-19. In the eur",False,No
531,2022-01-21,,Bank of Japan,coal,"hile giving consideration to underpinning the economy -- maintained its stance of further deleveraging the real estate sector. A few other members expressed the recognition that power supply issues had been alleviated, partly owing to an increase in coal supply. One of these members noted that it was difficult to build a new large-scale coal-fired power plant amid the global trend toward decarbonization; therefore, power supply issues could be a factor to push down the Chinese economy's medium- to l",True,Yes
531,2022-01-21,,Bank of Japan,decarbonization,"mbers expressed the recognition that power supply issues had been alleviated, partly owing to an increase in coal supply. One of these members noted that it was difficult to build a new large-scale coal-fired power plant amid the global trend toward decarbonization; therefore, power supply issues could be a factor to push down the Chinese economy's medium- to long-term growth, along with the aging population and strengthening of various controls.
Members shared the recognition that emerging economies had picke",True,Yes
532,2021-12-22,,Bank of Japan,climate change,"wth from a somewhat long-term perspective, it was important to also achieve increases in productivity and wages at small and medium-sized firms, where 70 percent of employees in Japan work, in addition to accelerating digitalization and responses to climate change in the corporate sector. 
Members concurred that, as the impact of COVID-19 waned gradually, overseas economies were likely to continue growing, albeit with variation across countries and regions, supported by aggressive macroeconomic policies taken",True,yes
532,2021-12-22,,Bank of Japan,renewable energy," the adaptive formation mechanism and thereby encourage further price rises. One member pointed out that the rise in energy prices could persist, putting upward pressure on prices, in a situation where oil and coal continued to be replaced mainly by renewable energy, with awareness of climate change issues heightening globally. One member expressed the view that, on the back of improvement in the output gap due to the further normalization of the economy, there was a possibility that a pass-through to consumer ",True,Yes
532,2021-12-22,,Bank of Japan,coal,"long-term inflation expectations through the adaptive formation mechanism and thereby encourage further price rises. One member pointed out that the rise in energy prices could persist, putting upward pressure on prices, in a situation where oil and coal continued to be replaced mainly by renewable energy, with awareness of climate change issues heightening globally. One member expressed the view that, on the back of improvement in the output gap due to the further normalization of the economy, ther",True,Yes
533,2021-11-02,,Bank of Japan,climate change,"nts in the automobile-related sector because of various supply-side constraints. The member continued that, however, the recovery trend of the economy had been maintained on the whole, supported by positive factors such as investments that addressed climate change and those related to digitalization, and thus there was no need to change the current scenario for economic recovery. One member noted that it was a positive development that the number of confirmed cases had recently turned to a decrease, but given",True,yes
533,2021-11-02,,Bank of Japan,greenhouse gas,"ontents of their own criteria and determination process. Regarding the requirements for ""Japan's actions"" to address climate change, investment or loans that applied to one of the following could be made eligible: (1) those that would reduce Japan's greenhouse gas emissions or other investment or loans for domestic businesses to address climate change; (2) those that would contribute to (1) through supply chains; (3) those for research and development for which outcomes would be conducive to (1); and (4) of t",True,Yes
533,2021-11-02,,Bank of Japan,carbon neutral,"es to relate it to the price stability target.
V5. Remarks by Government Representatives
The representative from the Ministry of Finance made the following remarks.

(1) With regard to climate change, the government had been working toward achieving carbon neutrality by 2050. It considered that the Climate Response Financing Operations reflected the Bank's proactive stance toward addressing climate change. It expected the Bank to appropriately proceed with preparations for the launch of the fund provision wit",True,Yes
533,2021-11-02,,Bank of Japan,carbon neutrality,"es to relate it to the price stability target.
V5. Remarks by Government Representatives
The representative from the Ministry of Finance made the following remarks.

(1) With regard to climate change, the government had been working toward achieving carbon neutrality by 2050. It considered that the Climate Response Financing Operations reflected the Bank's proactive stance toward addressing climate change. It expected the Bank to appropriately proceed with preparations for the launch of the fund provision within",True,yes
533,2021-11-02,,Bank of Japan,decarbonization," member expressed the view that, while bearing in mind a similar long-term horizon, the government and the Bank should fulfill their respective roles in making responses to the pandemic and addressing important challenges, such as digitalization and decarbonization. Moreover, one member said that, with regard to the implementation of the Special Deposit Facility to Enhance the Resilience of the Regional Financial System, under which special remunerations had started to be applied from the September 2021 mainte",True,yes
533,2021-11-02,,Bank of Japan,tcfd,"limate change. In terms of the details of ""a certain level of disclosure,"" the Bank could require counterparties to make public information on the four thematic areas in the Recommendations of the Task Force on Climate-related Financial Disclosures (TCFD) as well as on the targets and actual results for their investment or loans, with a view to ensuring that those wishing to be counterparties for the operations were organizationally committed to efforts to address climate change.
With respect to the",True,Yes
534,2021-09-28,,Bank of Japan,climate change,"ugh weakness had been seen in some industries. One member noted that there were reports at the July 2021 meeting of general managers of the Bank's branches of an expansion of investments related to such areas as digitalization, R&D, and responses to climate change. On this basis, the member continued that a virtuous cycle from corporate profits to business fixed investment, triggered by an increase in external demand, had not been disrupted.
With regard to private consumption, members agreed that it had been ",False,No
534,2021-09-28,,Bank of Japan,carbon neutral,"ould be investment or loans made by counterparties as part of their aforementioned efforts that contributed to Japan's actions to address climate change. Climate change is a global challenge, but as each country was making its own efforts to achieve carbon neutrality, it would be appropriate for the Bank, as the central bank of Japan, to design a scheme that supports Japan's actions to address climate change. The types of eligible investment or loans could include (1) green loans or bonds, (2) sustainability-",True,Yes
534,2021-09-28,,Bank of Japan,carbon neutrality,"ould be investment or loans made by counterparties as part of their aforementioned efforts that contributed to Japan's actions to address climate change. Climate change is a global challenge, but as each country was making its own efforts to achieve carbon neutrality, it would be appropriate for the Bank, as the central bank of Japan, to design a scheme that supports Japan's actions to address climate change. The types of eligible investment or loans could include (1) green loans or bonds, (2) sustainability-lin",True,Yes
534,2021-09-28,,Bank of Japan,transition risk,"tions currently being taken in each country, it would be appropriate for the Bank to support efforts that contributed to Japan's actions to address climate change. Some members expressed the view that, given such factors as the size of the impact of transition risks on Japan's economy, the measure should cover transition finance. A different member commented that, taking into account the fluidity of the external environment surrounding climate change, the Bank should carefully decide on the scope of the measur",True,Yes
535,2021-07-21,,Bank of Japan,climate change,"nk to decide at this meeting to extend the duration of the Special Program by six months until the end of March 2022, thereby continuing to support financing, mainly of firms.
Furthermore, members discussed possible monetary policy actions regarding climate change issues. Some members expressed the recognition that, since such issues could exert an extremely large impact on developments in economic activity and prices as well as financial conditions from a medium- to long-term perspective, they were relevant ",True,Yes
