minute_id,date,year,institution,keyword,context_snippet,is_climate_change,raw_response
857,2021-06-12,,Sveriges Riksbank,climate change,", we need to continue to develop 

the inflation forecasts. Let me mention three areas that I think will be particularly important in 

the coming years that were not as much in the spotlight a few years ago: the long-term effects of 

the pandemic, climate change and fiscal policy.   

First, the short-term effects of the pandemic on measuring inflation, restrictions and supply 

disruptions are well analysed. These will fade over time. However, my assessment is that the 

pandemic will also lead to changed ",True,Yes
857,2021-06-12,,Sveriges Riksbank,carbon tax,"that more frequent extreme weather leads to higher food and energy prices.8 In the 

coming years, it is possible that policy measures needed to address climate change may also have 

an impact on inflation, for example by more countries introducing carbon taxes and/or emissions 

trading. Inflation may also become more volatile and difficult to forecast as more countries and 

sectors are affected by both extreme weather and policies to mitigate climate change.9   

Third, in a world of low global real i",True,yes
858,2021-09-30,,Sveriges Riksbank,climate change," areas. Investments in the build-up of capital – both human capital and 

physical capital – will probably pay a high return, given today’s low interest rates. Also on the list 

of essential investments, we need investments to manage and counteract climate change. 

I shall conclude by summarising my views on the direction for monetary policy. The average rate 

for CPIF inflation in the past 20 years has been around 1.5 per cent. With this background: the 

fact that inflation is now according to our foreca",True,Yes
859,2021-10-05,,Sveriges Riksbank,green transition,"emote working.  

This is an example of how the pandemic has accelerated trends that were already underway 

before the crisis. Other examples are digitalisation of the services sector, increased e-Commerce 

and a greater focus on climate risks and green transition. How these structural changes affect 

growth, the labour market and inflation will be important to analyse in order to make an accurate 

forecast for the Swedish economy and inflation in the years to come.  

Allow me to summarise. There are reaso",False,No
859,2021-10-05,,Sveriges Riksbank,climate risk,"ossibilities for remote working.  

This is an example of how the pandemic has accelerated trends that were already underway 

before the crisis. Other examples are digitalisation of the services sector, increased e-Commerce 

and a greater focus on climate risks and green transition. How these structural changes affect 

growth, the labour market and inflation will be important to analyse in order to make an accurate 

forecast for the Swedish economy and inflation in the years to come.  

Allow me to summ",True,Yes
860,2021-12-07,,Sveriges Riksbank,fossil fuel,"he 

draft Monetary Policy Report about rising commodity prices and higher freight costs is the 

increase in metal prices. This increase is partly driven by the expectation of a high future demand 

for metals, linked to the gradual shift away from fossil fuels. Most likely, the upturn in commodity 

prices and freight costs is temporary and will lead to moderate effects on inflation over the next 

few years.  

However, brushing aside the risk of higher persistent inflation completely would be premature",False,No
865,2022-11-07,,Sveriges Riksbank,climate change,"t concerns the risks in the near term and what these mean for the forecast. 

Sweden and Europe are facing a tough autumn and winter. Global developments are currently 

characterised by a protracted war in Ukraine, lockdowns in China and effects of climate change in 

the form of heatwaves, floods and fires. This affects energy and food supply, risks driving up 

energy and food prices further and creating uncertainty about global value chains. All these 

factors suggest that we need to be prepared for low ",True,Yes
865,2022-11-07,,Sveriges Riksbank,greenhouse gas,"l for a decision on asset purchases in 

the second half of 2022 in greater detail. The annex also contains a proposal for a decision that 

the Riksbank shall only purchase corporate bonds issued by companies that report their annual 

emissions of greenhouse gases in accordance with the recommendations of the Task Force on 

Climate-related Financial Disclosures. It is proposed that this decision will apply from 1 

September 2022.  

§3b. The economic situation and monetary policy  

Deputy Governor Anna B",True,Yes
865,2022-11-07,,Sveriges Riksbank,oil and gas,"ame time, the markets are reflecting a high level of uncertainty linked to the war in Ukraine and 

the high inflation. This uncertainty is expressed, for instance, in high and rising volatility in several 

different markets. In the energy markets, oil and gas prices have been rising since the April 

meeting, partly as a result of the EU’s forthcoming sanctions against Russian oil and because 

Russia has stopped supplying natural gas to some European countries. 

Expectations of rate increases by the Ri",False,No
866,2023-02-10,,Sveriges Riksbank,climate change,"ide, 
meaning that the risk that inflation will be higher than forecast is greater than the 
risk it will be lower. The risk outlook includes continued high core inflation, a weak 
krona, a slowdown in China, the difficult geopolitical situation and climate change 
that may push up energy and food prices. When we are coming from a situation 

19 

 
with high inflation, it is more problematic if inflation is higher than forecast than 
the reverse (see alternative scenarios in Chapter 1 of the draft report). ",True,Yes
868,2023-04-12,,Sveriges Riksbank,green transition,"light that there is a need in Sweden and 
several other countries for military armament, that many countries have started 
to move production closer to home (known as “near-shoring” or “friend-shoring”) 
and that companies need to invest to meet the green transition. These are all 
factors that require new investment. This contributes to growth and employment, 
but can also lead to a shortage of input goods and commodities, which could 
contribute to higher inflationary pressures in the next few years. We are a",False,No
875,2016-10-18,,Reserve Bank of India,coal,"ar ago. In August, steel production rose to a 37-month high and cement production maintained momentum - auguring well for construction activity - even though the output of core industries as a whole was weighed down by a decline in the production of coal, crude oil and natural gas and deceleration in refinery products and electricity generation. Nonetheless, business expectations polled in the Reserve Bank’s industrial outlook survey and by other agencies remain expansionary in Q2 and Q3. The strong",False,No
876,2016-12-21,,Reserve Bank of India,coal,"er rabi sowing across major crops compared to a year ago should build on the robust performance of agriculture in Q2. By contrast, industrial activity remains weak. Among the core industries in the index of industrial production (IIP), the output of coal contracted in October due to subdued demand, while the production of crude oil and natural gas shrank under the binding constraint of structural impediments. The production of cement, fertilisers and electricity continued to decelerate, reflecting t",False,No
877,2017-02-22,,Reserve Bank of India,coal," a sequentially seasonally adjusted basis. The drivers of the upturn were steel production and petroleum refinery throughput, the former, inter alia, supported by import tariff safeguards and the latter buoyed by external demand. The acceleration in coal production and thermal electricity generation since November after three consecutive months of contraction augur well for the outlook for power. Reflecting these developments, the manufacturing purchasing managers’ index (PMI) returned to expansion ",False,No
878,2017-04-20,,Reserve Bank of India,coal," contract for the second successive month in spite of supportive base effects. Thus, investment and rural consumption demand remain muted. The output of core industries moderated in February due to slowdown in production of all the components except coal. The manufacturing purchasing managers’ index (PMI) remained in expansion mode in February and rose to a five month high in March on the back of growth of new orders and output. The future output index also rose strongly on forecasts of pick-up in d",False,No
879,2017-06-21,,Reserve Bank of India,coal,"duction expanded by 5.0 per cent during 2016-17 based on the new series (as against 0.7 per cent in the old series). Turning to the current financial year, the output of eight core industries decelerated sharply in April on account of contraction in coal, crude oil and cement due to structural constraints and low demand. Furthermore, electricity generation decelerated due to depressed demand pricing out relatively expensive thermal output. By contrast, the production of steel and fertiliser picked u",False,No
880,2017-08-16,,Reserve Bank of India,coal,"ril-June 2017 – and stocks have risen to 1.5 times the buffer norm for the quarter ending September. 11. Industrial performance has weakened in April-May 2017. This mainly reflected a broad-based loss of speed in manufacturing. Excess inventories of coal and near stagnant output of crude oil and refinery products combined to slow down mining activity. For electricity generation, deficiency of demand seems to remain a binding constraint. In terms of uses, the output of consumer non-durables accelerat",False,No
881,2017-10-18,,Reserve Bank of India,coal,"ponent of industrial GVA – grew by 1.2 per cent, the lowest in the last 20 quarters. The mining sector, which showed signs of improvement in the second half of 2016-17, entered into contraction mode again in Q1 of 2017-18, on account of a decline in coal production and subdued crude oil production. Services sector performance, however, improved markedly, supported mainly by trade, hotels, transport and communication, which bounced back after a persistent slowdown throughout 2016-17. Construction pic",False,No
882,2017-12-20,,Reserve Bank of India,coal,"egistered higher growth. GVA growth in the manufacturing sector – the key component of industry – accelerated sharply on improved demand and re-stocking post goods and services tax (GST) implementation. The mining sector expanded in Q2 due to higher coal and natural gas production. GVA growth in the electricity, gas, water supply and other utility services sector also strengthened on higher demand. In contrast, growth in agriculture and allied activities slackened, reflecting the lower than expected",False,No
883,2018-02-21,,Reserve Bank of India,coal," of overall business sentiment in the Indian manufacturing sector improved in Q3 as reflected in the Reserve Bank’s Industrial Outlook Survey (IOS). However, core sector growth decelerated in December due to contraction/deceleration in production of coal, crude oil, steel and electricity. Acreage in the case of wheat, oilseeds and coarse cereals was lower than last year. As a result, the shortfall in area sown for rabi crops increased to (-) 1.5 per cent as on February 2 as compared with (-) 1.0 per",False,No
885,2018-06-20,,Reserve Bank of India,coal,"ncreased significantly in Q4:2017-18 as revealed in the latest round of the Reserve Bank’s order books, inventories and capacity utilisation survey (OBICUS). The output of eight core industries accelerated in April on account of a sharp expansion in coal production, which reached a 42-month peak. Cement output also posted double-digit growth for the sixth consecutive month in April. However, electricity generation slowed down. As per the early results of the Reserve Bank’s April-June round of the in",False,no
886,2018-08-15,,Reserve Bank of India,coal," government’s thrust on national highways and rural housing, while the growth of consumer non-durables decelerated significantly. The output of eight core industries accelerated in June due to higher production in petroleum refinery products, steel, coal and cement. Capacity utilisation in the manufacturing sector remains robust. The assessment based on the Reserve Bank’s business expectations index (BEI) for Q1:2018-19 remained optimistic notwithstanding some softening in production, order books an",False,No
887,2018-10-19,,Reserve Bank of India,coal,"oods growth accelerated, driven by mining, electricity and petroleum refinery products. Growth in capital goods production spiked in June, but decelerated sharply in July. The output of eight core industries growth remained strong in July, driven by coal, petroleum refinery products, steel and cement, but moderated in August. Capacity utilisation (CU) declined from 75.2 per cent in Q4:2017-18 to 73.8 per cent in Q1:2018-19, while seasonally adjusted CU increased by 1.8 percentage points to the long-",False,No
888,2018-12-19,,Reserve Bank of India,coal," cent; seasonally adjusted CU also increased to 76.4 per cent. Available high frequency indicators suggest that industrial activity has been improving in Q3. The growth in core industries recovered in October on the back of double-digit expansion in coal, cement and electricity. The purchasing managers’ index (PMI) for manufacturing touched an eleven-month high of 54.0 in November, supported by an expansion in output, and domestic and export orders. According to the assessment of the Reserve Bank’s ",False,no
889,2019-02-21,,Reserve Bank of India,coal,"tivity, measured by the index of industrial production (IIP), slowed down in November. The year-on-year (y-o-y) growth in core industries decelerated to 2.6 per cent (y-o-y) in December, pulled down by a slowdown in the production of electricity and coal; and contraction in petroleum refinery products, crude oil and fertilisers output. Capacity utilisation (CU) in the manufacturing sector, as measured by the Reserve Bank’s order books, inventory and capacity utilisation survey (OBICUS), increased to",False,No
891,2019-06-20,,Reserve Bank of India,coal,"al Indian Ocean Dipole (IOD) conditions may turn positive in the middle of the monsoon season and persist thereafter, which augur well for the rainfall outlook. 13. Growth in eight core industries decelerated sharply in April, pulled down largely by coal, crude oil, fertilisers and cement. Credit flows from banks to large industries strengthened, though they remained muted for micro, small and medium industries. Based on early results of the Reserve Bank’s order books, inventory and capacity utilisa",False,No
893,2019-10-18,,Reserve Bank of India,coal,"ged as potential growth drivers. Infrastructure/construction sector activity turned around to register a growth of 2.1 per cent vis-à-vis (-)1.9 per cent in the previous month. The output of eight core industries contracted in August, pulled down by coal, electricity, crude oil and cement. Capacity utilisation (CU) in the manufacturing sector, measured by the OBICUS (order books, inventory and capacity utilisation survey) of the Reserve Bank, declined to 73.6 per cent in Q1:2019-20 from 76.1 per cen",False,No
894,2019-12-19,,Reserve Bank of India,coal,"same period a year ago. 13. Contraction in output of eight core industries – which constitute 40 per cent of the index of industrial production (IIP) – extended into the second consecutive month in October and became more pronounced, dragged down by coal, electricity, cement, natural gas and crude oil. However, output of fertilisers rose sharply, reflecting expectations of robust sowing activity in the rabi season. According to the early results of the Reserve Bank’s industrial outlook survey, overa",False,No
895,2020-02-20,,Reserve Bank of India,coal,"trial production (IIP), improved in November after contracting in the previous three months. The output of core industries returned to positive territory in December after four months of contraction, buoyed by five out of eight of its constituents – coal; refinery products; fertilisers; steel; and cement. Capacity utilisation (CU) in the manufacturing sector, measured by the Reserve Bank’s order books, inventory and capacity utilisation survey (OBICUS), fell to 69.1 per cent in Q2 from 73.6 per cent",False,No
903,2021-06-18,,Reserve Bank of India,esg,"t but recede thereafter if Kharif crop shapes well and if global commodity price pressures subside by then. Risks of elongated commodity pressures exist in face of piping-hot global economy but demand substitution across commodities supported by the ESG push might change relative prices thus halting or reversing the rising prices of crude oil, iron ore and steel. While prices of crude oil, pulses, edible oils and cotton are likely to put pressure on domestic inflation they can be contained by quick",False,No
904,2021-08-20,,Reserve Bank of India,climate change,". However, the spatial and temporal distribution of monsoon this season has been sub-par. While sowing deficiency that was large in early July has been largely bridged, some adverse impact on yields and outturn can emerge. These risks can magnify if climate changes cause a repeat of weather disruptions as has often happened of late with unseasonal rains affecting some horticulture crops. Second, the IIP in Q1 of 2021-22 is likely to remain below the pre-pandemic average for fiscal year 2019-20 as is already k",True,Yes
905,2021-10-22,,Reserve Bank of India,climate change,"o reversible supply shocks. There is large uncertainty built into current prices because of the speculative element that seeks to profit from aggravated shortages. Large sudden falls are therefore possible. Oil prices have shown high volatility. The climate change activism that is partly responsible for current spikes will also reduce oil demand in the future. There are signs of container prices softening as exports from China reduce. Policy has to be data based, since inflation may fall faster than guidance,",False,no
905,2021-10-22,,Reserve Bank of India,fossil fuel,"al subsidies and widen CAD by about 0.25% of GDP. Unless cooperative solutions are found, the underlying gas shortages in Europe are going to get worse in the winters and as they might enervate climate change commitments. The increased dependence on fossil fuels can structurally lift energy inflation and its passthrough to general price level. High imported coal prices are already affecting power generation in some coastal plants in India. Chips delivery time has gone up to 21 weeks from 12 weeks in the pr",True,Yes
905,2021-10-22,,Reserve Bank of India,coal,hortages in Europe are going to get worse in the winters and as they might enervate climate change commitments. The increased dependence on fossil fuels can structurally lift energy inflation and its passthrough to general price level. High imported coal prices are already affecting power generation in some coastal plants in India. Chips delivery time has gone up to 21 weeks from 12 weeks in the pre-pandemic period. Automakers are compelled to cut down production. Container freight rates are still o,True,Yes
907,2022-02-24,,Reserve Bank of India,oil and gas,"ing vaccine efficacy.57. Third, uncertainties about energy prices have risen considerably. Indian crude oil basket is up nearly 25% in the previous two months. The current geopolitical stress in Europe is a significant risk and if it translates into oil and gas prices spiking, we will need to adjust macro-economic policies suitably.58. Fourth, it is a no-brainer that the fiscal impulse needs to be factored in our monetary policy calculations. The pace of fiscal consolidation this year has been balanced by ",False,No
908,2022-04-22,,Reserve Bank of India,coal,"year as sowing in war torn Ukraine will be impacted. More importantly, in my assessment, core inflation is expected to stay above 6% through 2022-23 as the price shock from the war in Ukraine will be transmitted through mineral and metals as soaring coal prices and Palladium group and other metal shortages seep through to retail levels. They will also bring down growth and the resultant demand destruction may put some lid on surging commodity prices. 58. The global shock can have large spillovers to",False,No
908,2022-04-22,,Reserve Bank of India,oil and gas,"cipated global and domestic macroeconomic trajectories that were shaping will get reset in slope and intercept. In my statement in February, I had stated that “the current geopolitical stress in Europe is a significant risk and if it translates into oil and gas prices spiking, we will need to adjust macro-economic policies suitably”. The contingent risk has materialised calling for policy shifts. We are witnessing an entrenched conflict. While it remains unclear how long it may last, it looks that even on ",False,No
913,2022-12-21,,Reserve Bank of India,green economy,"ontraction, to attain a more sustainable current account deficit (CAD). These include export promotion, building domestic capacity and reducing dependence on oil imports. India’s remittances and software exports remain robust and the transition to a green economy is progressing well. Rising share of financial savings will also reduce the CAD. There are also multiple financing options for the CAD.41. Since India does not have full capital account convertibility, the uncovered interest parity (UIP) relation th",False,No
923,2024-08-22,,Reserve Bank of India,climate scenario," the projected patterns of both inflation and growth. In both the cases, risks faced are common: those associated with the monsoon and climate conditions, external demand and price conditions, and financial conditions. Under a favourable monsoon and climate scenario, food inflation is expected to moderate significantly and effective supply management policies provide an effective framework to address price spikes limited to a few commodities. However, persistent food inflation may require core inflation to soft",False,No
942,2022-03-17,,Bank of England,oil and gas,"e impact of the invasion on energy prices.  

Medium-term measures had also increased over the same period.  It was common for these 

measures to move together, but recent movements in medium-term measures were 

nevertheless noteworthy, given that oil and gas futures curves were consistent with energy 

price inflation falling back significantly beyond the near-term horizon. 

13 

In the United Kingdom, the increases in medium-term inflation compensation measures 

had taken their levels further above t",False,No
944,2021-12-16,,Bank of England,coal,"tors that had previously 

experienced the largest increases.  There had been mixed signals from early indicators of cost pressures.  

Wholesale gas spot prices had risen again in Europe and one-year futures prices had reached new highs.  Oil 

and coal prices had declined from their peak, with the Brent oil spot price now around $73 per barrel.  Shipping 

costs had remained elevated, but Chinese PMI manufacturing input prices had eased in the latest data.  Indices 

of prices and delivery times i",False,No
964,2018-06-21,,Bank of England,coal," in 

financial markets over the period since the Committee’s May Inflation Report.  Taken together, financial 

conditions – while still accommodative – had tightened somewhat. 

3 

Around the end of May, uncertainty surrounding the formation of a coalition government in Italy had 

culminated in sharp increases in the yields on Italian government bonds.  The Italian ten-year sovereign spread 

to German Bunds had risen from 130 basis points at the time of the MPC’s previous meeting to over 280 ba",False,No
966,2018-03-22,,Bank of England,oil and gas,"first quarter, 

although it was difficult to quantify the precise extent of this.  There would be offsetting effects from mining and 

quarrying output, which as expected had rebounded strongly in January, reflecting the re-opening of the Forties 

oil and gas pipeline system.  Other official data had been mixed.  For example, manufacturing output had risen 

for the ninth consecutive month in January, whereas construction output – a series that was often revised 

substantially – was estimated to have fa",False,no
988,2015-11-05,,Bank of England,oil and gas,"e contracted by 2.2%.  Service 

sector output had risen by 0.7%.  Production output had risen by 0.3%, largely on account of a 1.5% increase in 

the energy sector, while manufacturing output had fallen for the third consecutive quarter.  Excluding oil and gas 

extraction, ONS figures had shown growth of 0.5% in both Q2 and Q3.  Bank staff expected quarterly GDP 

growth in Q3 to be revised up to 0.6% as the data matured.  The ONS estimated that four-quarter growth had 

been 2.3% in Q3, continuing its g",False,No
991,2015-08-06,,Bank of England,coal," probably 

marginally stronger than in 2014.  The risks to that central expectation were judged to be moderately skewed to 

the downside. 

31  The new UK government’s Budget implied a broadly similar path of fiscal consolidation to the previous 

coalition’s plans, which had been factored into the Committee’s projections three months earlier.  If anything, 

slightly less of the consolidation was now planned during the Committee’s three-year forecast period, with 

correspondingly more after that",False,no
