minute_id,date,year,institution,keyword,context_snippet,is_climate_change,raw_response
4,2007-11-06,,Reserve Bank of Australia,coal," few months. The
						price of a barrel of WTI crude oil was now well over US$90. While part of the
						latest increase reflected the depreciation of the US dollar, the oil price
						had also risen in SDR terms. Ongoing strong global demand for coal and iron
						ore, important bulk commodity exports from Australia, suggested substantial
						increases in contract prices were likely in 2008.
					
Financial Markets

						There had been large fluctuations in sentiment in financial markets dur",False,no
5,2007-10-02,,Reserve Bank of Australia,coal,"e could be attributed to the depreciation of the
						US dollar. Oil prices had reached record high levels in the past few weeks,
						with the prices of both WTI and Tapis crude above US$80 per barrel. Spot prices
						of the bulk commodities of coal and iron ore, which are important Australian
						exports, had been strong, which suggested that the next round of contract price
						negotiations could see increases. Members noted that the outlook for commodity
						prices in general was firm.",False,No
8,2007-07-03,,Reserve Bank of Australia,coal,"he past few months from very
						high levels, with this mainly reflecting the trend in nickel prices. The latest
						expectations for next year's price increases for bulk commodity contracts
						had been revised up for both iron ore and coking coal.
					

						Oil prices had risen over the past month, to around US$70 per barrel for WTI crude.
						Members discussed the relationship between WTI and Malaysian (Tapis) crude
						prices, noting that the former was the global benchmark while th",False,no
10,2007-05-01,,Reserve Bank of Australia,coal,"he relatively modest growth in overall export volumes in the face
						of robust external demand was best understood by examining disaggregated data
						for the resources component. Members noted that while iron ore and, to a lesser
						extent, coal exports had increased rapidly in recent years, a trend decline
						in oil exports, owing to the depletion of existing oil fields, had weighed
						on the figures for total resource exports.
					

						Commodity prices had continued to rise in t",False,no
12,2007-03-06,,Reserve Bank of Australia,coal,"le and in an underlying sense the current account deficit had
						remained close to its cyclical high of about 6 per cent of GDP in
						the past few years.
					

						The latest contract prices for the bulk commodities of iron ore and steaming coal
						had increased by around 10 per cent and 5 per cent respectively,
						while prices for coking coal had declined by 15 per cent. Taking
						account of their shares in Australia's exports, the new contract prices
						would have a roughly ne",False,No
13,2007-02-06,,Reserve Bank of Australia,coal,"h in borrowing.
					

						Exports were estimated to have increased only moderately in volume terms in the December
						quarter, and by around 5 per cent over the year. Iron ore exports
						had increased steadily over the past few years, while coal exports had been
						relatively flat, with various infrastructure bottlenecks constraining growth.
						Oil exports had been on a falling trend until recently, but the opening of
						a new field had led to a pick-up in oil exports from mid 2006",False,No
15,2008-11-04,,Reserve Bank of Australia,coal,"t the demand
						for labour was slowing.
					

						Members discussed the effect of the falls in commodity prices on Australia's
						external position. Bulk commodity prices had fallen sharply in the past few
						months. Iron ore and thermal coal prices had fallen by around 60 per cent and
						40 per cent, respectively, since their peaks; spot prices were now well below
						the most recent contract prices for those commodities. Base metals prices had
						fallen significantly from their",False,No
16,2008-10-07,,Reserve Bank of Australia,coal,"rice had not been as marked in Australian
						dollar terms, as the exchange rate had generally appreciated when commodity
						prices were rising and depreciated when they fell, thereby dampening the effect
						of the US dollar price movements. Coal prices had also fallen. The premium
						between the spot thermal coal price and the most recent contract price, which
						had been close to 40 per cent around mid year, had been eroded; spot prices
						were now trading at a slight discount to ",False,no
17,2008-09-02,,Reserve Bank of Australia,coal,"ct of lower US dollar crude oil
						prices was not being felt by Australian households.
					

						Members discussed recent trends in spot commodity prices. The weakening world economy
						was weighing on commodity prices, with spot prices for coal and iron ore below
						the peaks reached in July. However, current spot prices for thermal coal were
						still well above the latest contract prices. Although refined metals and rural
						prices had fallen from the levels of a few months ago, ",False,No
18,2008-08-05,,Reserve Bank of Australia,coal,"o a small surplus in recent months. The increase in export values
						had largely reflected the higher prices, as export volumes had been little
						changed.
					

						Many commodity prices had eased somewhat over the past month. Nonetheless, coal and
						iron ore spot prices were still 30–40 per cent above the most recently
						established contract prices. The Tapis crude oil price had peaked at over US$150
						per barrel in mid July, but more recently had been trading around US$130 pe",False,no
21,2008-05-06,,Reserve Bank of Australia,coal," of Trade

						Members were briefed on the large increases in bulk commodity contract prices that
						had been agreed over the past month. In US dollar terms, there were price rises
						of 80 per cent for iron ore, over 200 per cent for coking coal and 125 per
						cent for thermal coal. Other commodity prices were also high at present. The
						price of Tapis crude oil had risen steadily so far this year, and base metals
						prices were not far below the peak reached in mid 2007 after hav",False,No
22,2008-04-01,,Reserve Bank of Australia,coal,"bserved that commodity prices had been volatile in the first quarter of
						2008. Prices for several commodities, including base metals and crude oil,
						had risen early in the year, then fluctuated below their early March peaks.
						The spot coal price had come off its peak somewhat, but the increase in the
						contract price for this year was still likely to be substantial.
					

						All up, the terms of trade were expected to increase by around 15 per cent in the
						middle of 2008,",False,No
23,2008-03-04,,Reserve Bank of Australia,coal,"8, which in January had been expected to rise
						by around 40 per cent, were now likely to rise by at least 65 per cent,
						based on a recent Japanese settlement with a Brazilian producer. A similar
						pattern was emerging in the market for coal, where the current spot price was
						more than double the 2007 contract price. Part of the pressure on coal prices
						had come from Chinese demand, as China had recently switched to being a net
						importer of coal. Negotiations over the 200",False,No
24,2008-02-05,,Reserve Bank of Australia,coal," increased
						very rapidly in the second half of 2007. As a consequence of the decline in
						base metals prices, the terms of trade had fallen somewhat in recent quarters.
						Members were informed that, with rises in new contract prices for coal and
						iron ore expected to be significant, the terms of trade were forecast to rise
						again in the first half of 2008. Thereafter, they were expected to drift lower,
						reflecting the effect of the expected slowing in world GDP growth.
		",False,No
26,2009-11-03,,Reserve Bank of Australia,coal,"asts were broadly similar to those discussed at the previous meeting.
						The outlook for commodity prices and the terms of trade had strengthened over
						recent months, and market expectations were for increases in the contract prices
						of coal and iron ore in 2010. GDP growth was expected to be close to trend
						over 2010, rising to around 3½ per cent by the end of the forecast
						period. Growth in the resources sector was expected to be strong, especially
						in the LNG industry.",False,No
27,2009-10-06,,Reserve Bank of Australia,coal,"indicated
						that the extreme caution in hiring plans earlier in the year was gradually
						being unwound. Measures of advertised job vacancies had also started to rise,
						albeit from levels well below earlier peaks.
					

						Exports of coal and iron ore were estimated to have risen significantly in the September
						quarter. Steel production outside of China had now grown by around 20 per
						cent, after a very sharp fall late in 2008. Production in China had been quicker
						to ",False,no
30,2009-07-07,,Reserve Bank of Australia,coal,"r falls being recorded in some cases.
						While the depreciation of the Australian dollar had been helpful to exporters,
						the strong performance of the Chinese economy was particularly important. Australia's
						exports of both iron ore and coal had recently rebounded after earlier large
						falls.
					

						Looking at consumption, members noted that retail sales had increased strongly in
						May and were 7 per cent higher than in September, a considerably stronger outcome
						than",False,No
31,2009-06-02,,Reserve Bank of Australia,coal,"the importance of China as a destination for Australia's exports,
						with China's share of merchandise exports rising from 5 per cent at the
						end of the 1990s to over 20 per cent now. Recently, Australian exports of iron
						ore and coking coal had benefited from increased demand from China at a time
						when other sources of demand had declined.
					

						Members noted that while measured employment had increased unexpectedly in April,
						forward indicators and information from bu",False,No
33,2009-04-07,,Reserve Bank of Australia,coal,"ecline in world
						trade had been arrested. Despite these signs of stability in external demand,
						the falls in commodity prices over 2008 meant that the terms of trade were
						forecast to fall during the period ahead, as new contracts for coal and iron
						ore came into effect. However, the expected level of the terms of trade over
						the next year or so was still relatively high.
					

						Conditions in the labour market had continued to soften. While part-time employment
						h",False,No
36,2010-12-07,,Reserve Bank of Australia,coal,"the global economy, base metals prices
						were lower over recent weeks. In contrast, the price of gold had risen. There
						had also been significant increases in the spot prices of the steel-making
						commodities, namely iron ore and coking coal, which were around 25 per
						cent and 10 per cent respectively above the December quarter contract prices,
						pointing to increases in contract prices for the March quarter. This was a
						stronger outcome than the staff had been expecting, ",False,No
37,2010-11-02,,Reserve Bank of Australia,coal,"ly
						positive, particularly for the resources sector, where the pipeline of work
						to be done was large. Members discussed developments in the LNG sector, including
						the recent investment decision on the project in Queensland to convert coal-seam
						methane to LNG. There were also positive indications for some other LNG projects
						that were still in the planning stage. Developments in the LNG sector, including
						the likely significant imported component, appeared to be broadl",False,No
41,2010-07-06,,Reserve Bank of Australia,coal,"			

						The slowing in growth in Chinese steel production had been reflected in falls in
						iron ore and steel prices. Spot prices for iron ore were now below the estimated
						contract price for the September quarter. Spot prices for coking coal had also
						eased. Nevertheless, these prices remained very high from a longer-term perspective,
						and the terms of trade were approaching the peak level seen in 2008.
					

						There were some signs that conditions in the established hous",False,No
43,2010-05-04,,Reserve Bank of Australia,coal," demand for steel-related commodities. Contract
						prices for iron ore were estimated to have risen by close to 100 per cent in
						the June quarter, with spot prices strengthening further since those contracts
						had been negotiated. Coking coal prices had recently also risen significantly.
					

						Given these increases in commodity prices, the staff forecast for the terms
						of trade had been revised upwards. The terms of trade were now expected to
						rise by close to 20 per cen",False,No
44,2010-04-06,,Reserve Bank of Australia,coal,"ng plans outside the mining sector. The non-residential
						building sector remained subdued and, abstracting from the surge in construction
						of educational facilities, new approvals were at relatively low levels.
					

						Spot prices for coal, iron ore and other resources had continued to rise over
						the past month. The price negotiations for iron ore indicated a fairly broad-based
						shift to price-setting on a quarterly, rather than annual, basis. Although
						spot iron ore pr",False,No
46,2010-02-02,,Reserve Bank of Australia,coal," to a rate of 3¼–3½ per
						cent over the remainder of the forecast period. Growth in the mining sector
						was expected to be significantly stronger, partly reflecting the expected growth
						in the LNG sector and upward revisions to expected coal and iron ore prices.
						Growth outside of the resources sector was expected to be more subdued. Higher
						commodity prices meant that the forecast for the terms of trade in the coming
						year had been revised up significantly.
					

						",False,No
47,2011-12-06,,Reserve Bank of Australia,coal,"ey also confirmed
						that the investment outlook remained very strong, with a small upward revision
						to spending plans for 2011/12 from what was an already very positive outlook.
						There had been further announcements of new iron ore and coal projects over
						the past month and the expansion of the LNG sector was continuing.
					

						The national accounts for the September quarter would be released the day after the
						meeting. Growth in private demand was expected to be strong",False,No
48,2011-11-01,,Reserve Bank of Australia,coal,"ft. In contrast,
						conditions in the resources sector were very positive and, consistent with
						this, there has been strong growth in imports of capital goods. Iron ore exports
						had risen strongly over recent months, but the recovery in coal exports continued
						to be slower than earlier expected because of difficulties in removing water
						from flooded mines. Information from the Bureau of Meteorology suggested a
						growing risk of a wetter-than-usual summer, which could furth",False,No
49,2011-10-04,,Reserve Bank of Australia,coal,"ctor. This was
						being partly offset by weak growth in public demand as the fiscal stimulus
						was being unwound, and by strong growth in imports, particularly of capital
						goods. GDP outcomes continued to be affected by the disruption to coal production
						caused by the floods at the beginning of the year, with a full recovery still
						not expected until early 2012.
					

						The national accounts confirmed that growth in household spending on goods had
						been quite modest, ",False,No
50,2011-09-06,,Reserve Bank of Australia,coal,"e prices of most exchange-traded commodities had fallen over August, though the
						falls were relatively small compared with those seen in late 2008 and prices
						remained at high levels. In contrast, spot prices for iron ore and thermal
						coal had risen slightly over the month, with physical demand from Asia continuing
						to be strong. Overall, Australia's terms of trade were expected to be at
						their highest level on record in the September quarter, before gradually declining
				",False,No
51,2011-08-02,,Reserve Bank of Australia,coal,"verall, Australia's terms of trade had reached their highest level
						on record in the June quarter and were now expected to increase further in
						the September quarter, before declining gradually as more global capacity in
						iron ore and coal came on line.
					
Domestic Economic Conditions

						The main economic news over the past month had been the inflation data. In the June
						quarter, the CPI had increased by 0.9 per cent, to be 3.6 per cent higher over
						the year. Measures",False,No
52,2011-07-05,,Reserve Bank of Australia,coal,"t with this,
						capital imports had trended higher over recent months. In contrast, investment
						in the non-mining sector remained soft, with signs yet to emerge of a pick-up
						in non-residential construction.
					

						The recovery of coal exports from the Queensland floods was taking significantly
						longer than earlier expected, and the return to full capacity could be delayed
						to early 2012. In contrast, iron ore exports had already bounced back from
						the weather-induc",False,No
53,2011-06-07,,Reserve Bank of Australia,coal,"ommodities in early May amid a fall in global financial
						markets, but prices for most commodities had since recovered somewhat. Spot
						prices for bulk commodities had also softened a little, but contract prices
						for iron ore and coking coal were expected to remain at near-record levels
						in the September quarter.
					
Domestic Economic Conditions

						GDP was estimated to have fallen by 1.2 per cent in the March quarter. The fall in
						coal and iron ore exports – which reflec",False,No
54,2011-05-03,,Reserve Bank of Australia,coal,"ces had increased further since the April meeting, with the price of Tapis
						crude rising to around US$130 per barrel. The prices of Australia's
						bulk commodity exports had also risen, with annual benchmark contract prices
						for thermal coal exports settling at around US$130 per tonne, a little
						above what had been expected, and spot iron ore prices had also moved higher.
						In contrast, the prices of some food items had declined over the past month,
						as global supply conce",False,No
55,2011-04-05,,Reserve Bank of Australia,coal,"lso be some effects on regional supply chains, though the effects on
						global activity were likely to be relatively limited. For Australia, Japan
						was the second most important export destination, accounting for nearly half
						of thermal coal exports and close to one-fifth of iron ore exports. In the
						very short term, it was likely there would be some disruption to exports of
						goods and services to Japan, though, beyond this, the rebuilding effort and
						a possible increase ",False,No
56,2011-03-01,,Reserve Bank of Australia,coal,"as expected to increase
						to above 4 per cent in the near term and to remain above target until
						2012.
					
Domestic Economic Conditions

						The effect of the floods on the economy was becoming evident in the regular flow
						of data. Coal shipments from Queensland ports had declined sharply in January,
						consistent with the staff's earlier expectations. The staff continued to
						expect that the floods could take around ½ percentage point off
						growth in each of the Decembe",False,No
57,2011-02-01,,Reserve Bank of Australia,coal,"by poor weather.
					

						The recent growth in global demand and industrial production, together with weather-related
						disruptions to supply, had seen generalised strength in commodity prices over
						recent months. Spot prices for coking coal had risen very sharply, in part
						reflecting the fall in production in Queensland following the floods. The spot
						price for iron ore was around its record high levels, as was the IMF's index
						of global food prices. Oil and base metals ",False,No
58,2012-12-04,,Reserve Bank of Australia,coal,"ies to address competitiveness and fiscal challenges, although these challenges
						remained substantial.
					

						Members noted that, overall, global commodity prices were little changed since the
						previous Board meeting. Spot prices for coal had picked up slightly after falling
						over most of the year. Base metals prices had risen, while rural prices were
						little changed and iron ore prices had recorded a modest decline. The terms
						of trade fell in the September quarter an",False,No
59,2012-11-06,,Reserve Bank of Australia,coal,"Members noted that the spot price
						for iron ore had recently increased in line with a rise in steel production
						and prices, but remained well below levels seen earlier in the year. In contrast,
						spot prices for both thermal and coking coal had declined further. Global food
						prices were higher and base metals prices remained broadly unchanged from the
						middle of the year. The terms of trade were estimated to have declined further
						in the September quarter, and were forec",False,No
60,2012-10-02,,Reserve Bank of Australia,coal,"					world economy for some time.
					

						Overall, commodity prices were relatively flat in net terms over the month. The spot
						price for iron ore had recovered some of the sharp fall in August. In contrast,
						the spot price for coking coal had continued to drift lower. The prices for
						both commodities remained around 25 per cent below their levels in June. The
						terms of trade were estimated to have fallen further in the September quarter
						to be more than 10 per cent bel",False,No
61,2012-09-04,,Reserve Bank of Australia,coal,"ic activity in the rest of
						Asia and the United States appeared to have expanded at a modest pace. Economic
						conditions remained weak in Europe. Against this background, there had been
						sharp falls in the prices of iron ore and coking coal more recently.
					

						Members observed that data on economic activity in China had been a bit weaker of
						late. The manufacturing PMI fell back in August and the value of exports over
						the year to July was broadly flat. In July, consu",False,No
62,2012-08-07,,Reserve Bank of Australia,coal,"urther significant
						economic adjustment seemed necessary and the challenges ahead for the euro
						area remained substantial.
					

						Commodity price movements had been mixed over the past month. Spot prices for iron
						ore and coking coal had declined recently, consistent with a softening in global
						demand and rising supply. However, prices for oil and some rural commodities
						had increased over the past month because of supply disruptions, with drought
						in the US and B",False,No
63,2012-07-03,,Reserve Bank of Australia,coal,"tle further in the June quarter, although they remained at historically
						high levels. Iron ore prices were little changed over the past month, after
						falling sharply in May. Reflecting weaker global demand, prices for oil and
						thermal coal had fallen substantially. In contrast, spot prices for coking
						coal had increased, in part owing to supply concerns related to industrial
						action in Australia.
					
Domestic Economic Conditions

						Members noted that data released over",False,No
64,2012-06-05,,Reserve Bank of Australia,carbon tax,"dually, but the unemployment rate was still
						expected to move somewhat higher over the coming quarters. Output growth was
						expected to increase towards trend over the remainder of this year, and inflation
						(excluding the impact of the carbon tax) was expected to remain in the lower
						part of the 2–3 per cent range.
					

						The Board considered whether the recent information warranted a further reduction
						in the cash rate.
					

						The arguments were finely balanced. Recent",False,No
64,2012-06-05,,Reserve Bank of Australia,coal,"					likely to ease policies in a more measured way than was the case in the earlier
						episode.
					

						The softening in global activity had been associated with a general decline in commodity
						prices. Spot prices for iron ore, thermal coal and crude oil declined significantly
						over the month. While part of the fall in iron ore prices reflected an easing
						in earlier supply disruptions in Australia and Brazil, economic weakness in
						Europe and an easing in Chinese steel pr",False,No
65,2012-05-01,,Reserve Bank of Australia,coal," The spot price for iron ore had continued to
						drift higher since the start of the year, consistent with signs of a recovery
						in Chinese steel production as well as some supply disruptions in Australia
						and Brazil. In contrast, coking coal prices had softened as supply from Queensland
						had returned to its level prior to the flooding in early 2011, and base metals
						prices had trended lower in recent months.
					
Domestic Economic Conditions

						Members noted that the avai",False,No
66,2012-04-03,,Reserve Bank of Australia,coal,"clined in March.
					

						After peaking in the September quarter, Australia's terms of trade fell
						by almost 5 per cent in the December quarter 2011, owing to declines
						in bulk commodity prices. Since the start of 2012, spot prices for coal had
						fallen by 6–7½ per cent, but iron ore prices had increased
						by around 10 per cent. Over the same period, Tapis crude oil prices had
						increased by 14 per cent, to US$134 per barrel, in part reflecting
						concerns about future s",False,No
