minute_id,date,year,institution,keyword,context_snippet,is_climate_change,raw_response
1781,2021-08-26,,Bank of Mexico,climate change,"Infrastructure, Investment and Employment Program 
which contemplates investments of around 1.2 
trillion dollars over the next 8 years, as well as 
such as the discussion of a budget proposal 
for about $3.5 billion directed to 
social programs and climate change. In the event of 
that the legislation of the Infrastructure Program 
be ratified by the House of Representatives, and 
that the budget proposal for social spending 

residential contracted and 
Followed 

11 

20253035404550556065201520162017201820",True,yes
1785,2021-02-25,,Bank of Mexico,oil and gas,"ed monthly rate,  
reflecting, to a large extent, an expansion in the 
electricity and gas sector derived from a rebound in 
in the demand for heating. For its part, the 
mining activity continued to be supported by the largest 
pace of drilling and oil and gas extraction, 
while manufacturing activity continued 
gradually recovering. In this context, the 
Industry Purchasing Managers' Index 
manufacturing (PMI)2 continued to rise in January,  

1 Expressed as annualized quarterly rate and adjusted for 
se",False,No
1787,2020-11-26,,Bank of Mexico,oil and gas,"arm, and, to a lesser extent, a 
decline in the manufacturing sector resulting from 
Computer 
a minor 
electronics and motor vehicles. For its part, the 
mining sector recorded an increase driven by 
increased extraction and drilling of wells from 
oil and gas. In this context, indicators 
available as of October, as the Index of Managers of 
industry purchasing (PMI) 
Manufacturing Forecasts Suggest a Moderate Recovery 
of this sector. production 

of 

Likewise, the recovery of employment in the United ",False,No
1794,2020-02-27,,Bank of Mexico,oil and gas,"nited States 
Subsequently, they registered a significant 
fall as a result of the expected reduction in demand 
by oil, especially by China, in the face of 
the coronavirus outbreak. The decrease in 
tensions in the Middle East and the increase in 
oil and gasoline inventories in the United States 
United accentuated this fall. In turn, the prices 
of industrial metals and grains showed 
a decrease due to the 
the 
health emergency in China affects its 
economy. fear that 

and 

A.1.2. Monetary policy an",False,No
1798,2019-08-29,,Bank of Mexico,renewable energy,"ressed that 
Analysts have mentioned that the proposed plan does not 
explicitly presents strategic planning 
that recognizes the international environment on the 
oil demand in the context of 
the 
expected economic slowdown, or the use of 
growing renewable energy supply. Most 
He pointed out that the increase has not been reversed 
recorded in previous months in premiums for 
the company's non-payment, and that the 
market still discounting a further decline in 
Pemex's credit rating. One added that 
This ca",False,no
1803,2019-01-03,,Bank of Mexico,climate change," due to a 
exchange rate trajectory more depreciated than 
and higher prices of agricultural products, 
particularly, fruits and vegetables. One of them 
specified that the upward revision of prices in 
these categories – the result of affectations 
climate change—partially compensates for the drop in 
energy prices. Another added to the factors 
that affect inflation forecasts on 
recent increase in minimum wages. the 

uncertainty 

The majority of members considered that the 
balance of risks with respect ",True,Yes
1808,2018-05-31,,Bank of Mexico,climate change,"adjusted figures. Source: Bureau of Economic Analysis. Industrial production in the United States increased 
0.7% at a monthly rate in April. This expansion 
was due to the continuous recovery of supply 
of electricity and gas, after the conditions 
climate change will normalize after the temperatures 
unusually warm temperatures that were recorded in the early 
of the year and that contributed to lower demand 
for heating, as well as for the continuous strength 
of mining-related activity 
of oil and gas. In",True,Yes
1808,2018-05-31,,Bank of Mexico,oil and gas,"
climate change will normalize after the temperatures 
unusually warm temperatures that were recorded in the early 
of the year and that contributed to lower demand 
for heating, as well as for the continuous strength 
of mining-related activity 
of oil and gas. In addition, manufactures 
expanded significantly in that month, 
due, to a large extent, to the strong expansion of 
the production of equipment, suggesting that the 
slowdown in investment in this area in the 
The first quarter of the year could ",True,Yes
1809,2018-04-26,,Bank of Mexico,coal,"Sector1/ 
Percentages of potential output, a. e. 

Figure 19 
National Unemployment Rate and Unemployment Rate 
Urban Unemployment 
Percent, a. e. 

1/ Excludes oil and gas extraction, services related to 
mining and the manufacture of petroleum and coal products. Estimated with the Hodrick-Prescott filter with tail correction;  see 
Bank of Mexico (2009), ""Report on Inflation, April-June 2009"", 
p.74. 2/ GDP figures for the fourth quarter of 2017;  IGAE figures as of January 
2018. 3/ Confidence in",False,No
1809,2018-04-26,,Bank of Mexico,oil and gas,"ip. Industrial production in the United States continued 
expanding in January and February, after a 
strong rebound in the fourth quarter of 2017. Saying 
growth was supported both by the 
mining company, which reflected the gains in production 
of oil and gas, such as 
Production 
manufacturing, especially in its component of 
Consumer durables. The above was seen 
partially offset by the weakening in 
the supply of electricity and gas, in the face of the minor 
Heating demand due to temperatures 
warmer",False,No
1810,2018-02-22,,Bank of Mexico,esg,"2%14%16%18%Shanghai (China)S&P 500 (USA)FTSE MIB (Italy)FTSE-100 (UK)CAC (France)Nikkei (Japan)DAX (Germany)AUDEURGBPJPYCADDXY 1/3431171711151433932243-30-20-10010203040506070CanadaUnited StatesFranceGermanyGermanyJapanCanadaUnited KingdomUnited StatesGermanyFranceJapanJapanPercentageBase Points<--Equity Markets<--CurrenciesGovernment Bond Rates with a 10-Year Maturity -->Government Bond Rates with a 2-Year Maturity --> 
 
Figure 8 
Mexican Peso Exchange Rate 
Pesos per dollar  

Figure 9 
Range of",False,No
1811,2017-12-28,,Bank of Mexico,esg," (Europe)FTSE MIB (Italy)GBPEURJPYCHFNZDAUDCADDXY 1/-10%-8%-6%-4%-2%0%2%4%6%8%10%United StatesCanadaGermanyJapanFranceSpainItalyUnited KingdomJapanItalySpainCanadaFranceUnited Kingdom-25-20-15-10-10-50510152025Basis Points<--Equity Markets<--CurrenciesGovernment Bond Rates with a Maturity of 10 Years -->Percentage, Basis PointsRates of Government bonds with a maturity of 2 years -->Percentage 
 
Going forward, episodes of greater 
volatility due to the existence of various risks, 
among which unant",False,No
1811,2017-12-28,,Bank of Mexico,oil and gas,"trial Activity and Platform 
Oil Production 
2013 Indices = 100, a.e. 

to.  and.  / Seasonally adjusted series and trend series. The first is 
represents with the solid line and the second with the dotted line. 1/ The November 2017 figure for crude oil and gas extraction 
corresponds to the average from the 1st to the 19th of that month. Source: System of National Accounts of Mexico (SCNM), INEGI. 15). Additionally, 

The estimation of the output gap to the third 
quarter of 2017 does not indicate demand ",False,No
1813,2017-10-12,,Bank of Mexico,esg,"anghai (China)CAC 40 (France)Nikkei (Japan)S&P 500 (USA)FTSE-100 (UK)GBPCADEURAUDCHFNZDJPYDXY 1/-5%-4%-3%-2%-1%0%1%2%3%4%5%United KingdomCanadaSpainItalyFranceGermanyJapan-30-25-20-15-10-5051015202530Basis pointsPercentage<--Equity markets<--CurrenciesGovernment bond rates with a maturity of 10 years -->Percentage, basis points 
 
Figure 7 
Cumulative flows to emerging countries by 
region during 2017 
Millions of dollars 

Note: Latin America is made up of flows from Brazil, Colombia, and 
Mexico.",False,No
1819,2016-12-29,,Bank of Mexico,oil and gas,"red a 
expansion, which reflected greater activity of 

2 

-6-4-20246IIIIIIIIIIVIIIIIIIIIIIIIIIIIIIV201420152016Private consumptionResidential investmentNon-residential investmentInventoriesNet exportsPublic expenditureTotal4th.Quarter.Forecasts 
 
oil and gas extraction and increased production 
the 
of equipment for such activities, in the face of 
recovery in oil prices (Graph 2). Graph 2  
USA: Components of Industrial Production 
Index January 2012=100, a. e. 

Graph 3 
USA: Unemployment Measures 
In",False,No
1822,2016-08-25,,Bank of Mexico,esg,%-20.-2%1%3%2%-2%-2%-2%-2%-2%-2%-2%-2%-2%-2%-2%-2%-2%-2%-2%3%-20.-2%1%3%-2%2%3%-20.1%3%3%-20.1%3%3%3%-20.1%3%3%2%3%2%2%2%3%-20.1%1%3%3%-20.0%-17.5%-15.0%-12.5%-10.0%-7.5%-5.0%-2.5%0.0%2.5%5.0%7.5%10.0%12.5%15.0%SpainFranceChinaGermanyJapanUnited StatesGBPCHFCADEURNZDJPYAUDDXY**Change from 22-Jun-16 to 08-Aug-16Stock indicesCurrencies*-70-51-31-27-13-10-80-70-60-50-40-30-20-100102030405060United KingdomSpainItalyFranceGermanyUnited StatesRange from 22-Jun-16 to 08-Aug-1610 10-year government bond ra,False,No
1823,2016-07-14,,Bank of Mexico,esg,"-1501530456075S&P 500 (USA)FTSE-100 (UK)Nikkei (Japan)DAX (Germany)CAC 40 (France)IBEX (Spain)FTSE MIB (Italy)JPYDXY 1/NZDCHFCNYCADAUDEURGBP-30%-25%-20%-15%-10%-5%0%5%10%15%20%25%Currency depreciation against USDPorcentage<--Equity markets<--CurrenciesGovernment bond rates with a maturity of 10 years -->Currency appreciation against USDVariation from 02-May-16 to 27-Jun-16Base points1,511,461,451,090,930.29-0.12-0.19-0.54-20246810ItalyUnited StatesSpainCanadaKingdom United KingdomFranceGermanyJapan",False,No
1827,2015-12-31,,Bank of Mexico,oil and gas,"n continued 
being solid and was driven by the growth of the 
disposable personal income and net wealth of 
households. For its part, the new orders for 
capital goods rebounded recently, despite 
of the negative impact of exploration activity, and 
oil and gas extraction, suggesting a 
Recovery of the investment in equipment. Graph 2 
USA: Real GDP and Components 
Annualized quarterly change and contribution in 
percentage points, a. e. 

a. e. / Seasonally adjusted figures. Source: BEA. 2 

Advanced 0123",False,No
1833,2015-04-09,,Bank of Mexico,esg,"

in 

Figure 9 
Foreign Investors Holding in 
Government Values 
Percentage of total amount placed 

Note: The total amount placed includes D Bonds and IPAB. Source: Bank of Mexico and Indeval. 6 

60708090100110120130EFMAJJAONDEMDivisasÍndices sharesGovernment securities in local currencyGovernment securities in foreign currencyHigher priceLowest price20142015Pesos per dollarLower trading volume Highest trading volume 12,513,013,514,014,515,015,516.0EFMAMJASONDEM20142015Data from the Summary file",False,no
1849,2013-03-22,,Bank of Mexico,coal,"asonally adjusted figures. Source: CPB Netherlands. Market indicators that measure the risk of 
Sovereign credit of euro area countries 
increased, after the results of the 
past elections in Italy. Uncertainty with 
regarding the formation of a new coalition of 
stable government in that country, which is capable of 
continuing with the necessary reforms, could lead to 
an increase in market volatility 
and a reduction in the 
Investors by assets 
demand for 
such as bonds from EU countries, 
Europ",False,No
1854,2012-08-03,,Bank of Mexico,climate change,"h 9), being also affected, 
in some cases, due to the drop in the prices of 
raw materials that make up a part 
important of its production. grains for 

Regarding this last point, 
Prices 
of the main raw materials, 
Reasons 
with the exception of 
climate change, fell significantly in 
the last few months, mainly as a result of 
of the slowdown in the world economy and the 
deterioration of their prospects. In particular, the 
international oil prices showed a 
marked decrease from March, although 
recently",False,no
1865,2011-03-18,,Bank of Mexico,esg,"end, 
mainly in response to uncertainty 
the 
geopolitics and 
international financial markets (Graph 9). resulting volatility in 

the 

4 

2.02.22.42.62.83.03.23.43.63.84.0Sep 10Oct 10Nov 10Dec 10Jan 11Feb 11United KingdomUnited KingdomUnited StatesGermanyS O N D E F2010 2011 
 
Notwithstanding the above, the movement in the 
market was ordered. Figure 10 
Performance curve    
Base points, percent   

Figure 9 
Peso-dollar exchange rate   
Pesos per dollar  

Source: Bloomberg. Source: Bloomber",False,No
1872,2024-02-07,,National Bank of Poland,energy transition,"t is currently unclear whether and to what extent the proposals 

These will be implemented.  In this context, some members of the Council pointed out that, 

especially in view of the need to increase public spending for military purposes and for 

energy transition, the scope for increasing the expansiveness of fiscal policy is 

limited and consolidation activities should be expected.  

3/4 

Majority 

Council members assessed that, despite the observed recovery in the 

demand and cost pressures in the Pol",False,No
1877,2023-09-06,,National Bank of Poland,zero-emission,"-on-year. It was emphasized that the data coming in Q3. 

signal a further deterioration in the economic situation in the euro area, including in Germany. Moreover 

it was noted that in China the recovery of activity after abandoning the so-called  zero-emission policy.

Covid"" is going much slower than expected.  In the United States, on the other hand, 

The current economic situation remains better than in the euro area. 

The Council members pointed out that the weak economic situation in the world, tog",False,No
1877,2023-09-06,,National Bank of Poland,energy transition,"growth in Poland, which – due to the statistical base effect – 

currently limits the annual dynamics of this category.  At the same time, there was an opinion that 

The current slowdown in the Polish economy is largely structural, 

related to the energy transition and the consequences of the COVID-19 pandemic. 

The incoming data indicate that in Q3.  2023  economic situation remained 

Impaired. Retail sales and industrial production decreased in July 2023 

on an annual basis.  The manufacturing PMI also si",False,No
1885,2022-12-07,,National Bank of Poland,coal," the decline in fuel prices, related to the fall in oil prices, on the 

markets and the appreciation of the zloty. It was estimated that the reduction of inflation could have been supported by 

also the likely decline in fuel prices, in particular coal. At the same time, it was emphasized that 

that consumer price growth remains strong, which is largely related to the 

impact of strong external shocks, in particular on global prices, in the context of 

raw materials, which – in conditions of st",False,No
1888,2022-09-07,,National Bank of Poland,coal,"ignificant uncertainty. It was pointed out that the negative impact on the 

activity, m.in strong increases in the prices of energy and its carriers, although these effects will be 

the extension of the Anti-Inflation Shield or the introduction of coal allowances and 

heating subsidies. 

2/4 

During the discussion, it was noted that the situation on the labour market remains very good, which is 

reflected in the record low unemployment rate and the persistence of the 

a significant increase i",False,No
1890,2022-06-08,,National Bank of Poland,coal,"creasing the pace of supplies, which in turn should somewhat ease tensions on the oil market. 

1/4 

It was emphasized that the price of crude oil has increased by more than 50% over the last year, and 

the last two years by almost 200%.  European coal and gas prices are also several times higher 

Higher.  It was also pointed out that the consequence of the shock to the 

raw materials market 

energy markets and the war in Ukraine is also a strong increase in prices on agricultural markets.  

I",False,No
1891,2022-05-05,,National Bank of Poland,coal,"actors 

inflation processes has recently intensified due to the Russian aggression against Ukraine. 

In particular, oil prices rose again, despite the decision to start 

the sale of oil inventories by the United States. At the same time, European coal prices 

and gas are several times higher than a year ago.  This was accompanied by a strong increase in prices 

agricultural commodity price index, which resulted in the highest level of 

level in history. The members of the Council pointed out t",False,No
1892,2022-04-06,,National Bank of Poland,oil and gas,"
increase in global inflation, mainly through the related increase in prices and prices, in the context of the 

global markets and the intensification of international trade disruptions. In 

In particular, the Council members have pointed out that oil and gas prices are indeed 

higher than before the start of the Russian aggression. Agricultural raw materials also rose sharply – 

wheat, in particular, and the Global Agricultural Commodity Price Index reached 

the highest level in history.  It was poin",False,no
1893,2022-03-08,,National Bank of Poland,coal,"Russia and Ukraine. In particular, it was pointed out that gas prices in Europe were on the basis of 

at the beginning of March were more than twice as high as in January, and oil prices 

Brent has temporarily reached its highest level since 2008. Coal prices also rose sharply. 

At the same time, the prices of agricultural raw materials, including wheat and corn, also rose markedly. 

It was noted that conducive to higher prices of agricultural raw materials will not only be 

only their limited ",False,no
1894,2022-02-08,,National Bank of Poland,carbon dioxide,"d that the increase in inflation in 2021.  occurred primarily under the influence of 

external factors beyond the control of monetary policy.  To the factors 

These included increases in global commodity prices, record increases in the prices of 

carbon dioxide emissions, rising commodity prices, the supply of which is constrained by the 

global pandemic disruptions as well as those made in 2021.  Energy price increases 

electricity and natural gas, which are largely the result of the translating of the ",False,No
1894,2022-02-08,,National Bank of Poland,climate policy," a global scale. 

Global.  Prolonged disturbances in the 

functioning of global supply chains and the still high transport prices of the 

International.  In the European Union, it is important to 

factor in addition to the 

increasing prices is climate policy.  The members of the Council pointed out that in the case of 

In many countries, inflation is at its highest level in decades, including in the Eurozone in January this year. 

The HICP accelerated to 5.1%, and in the United States, CPI inflation i",False,No
1895,2022-01-04,,National Bank of Poland,climate policy,"ember its prices 

were 5 times higher than the year before.  It was emphasized that in Europe an additional 

A factor increasing the prices of energy carriers are very high prices of allowances 

CO2 emissions related to the tightening of the EU's climate policy.  Simultaneously 

disruptions in global supply chains are prolonged, and transport prices 

international level are still elevated.  According to the members of the Council, the 

factors, together with a strong recovery in demand, are contributing",True,Yes
1896,2021-12-08,,National Bank of Poland,climate policy,"n 

natural gas supply. At the same time, in Europe, in addition to the jumping and very 

strong increase in gas prices, the factor driving up energy prices is a very strong 

an increase in the prices of CO2 emission allowances related to the EU's climate policy.  

Council members pointed out that high commodity prices, combined with the prolongation of the 

disruptions in the functioning of global supply chains and the still high levels of 

international transport prices, contribute to a marked increase",True,yes
1896,2021-12-08,,National Bank of Poland,coal,"nt forecasts in 2022. 

global GDP growth will remain relatively high, although lower than in 2021.  

It was pointed out that the prices of raw materials are still much higher than a year earlier, which concerns 

in particular natural gas, oil and coal, as well as some agricultural raw materials. 

It was pointed out that despite some decline in oil prices in response to the 

deterioration in financial market sentiment and increased risk aversion after the 

the first news about Omicron, the aver",False,No
1897,2021-11-03,,National Bank of Poland,coal,"was pointed out that commodity prices on global markets remain much higher than 

a year ago. Gas prices – despite some correction recently – still several times 

above the levels recorded in autumn 2020. Crude oil also remains more expensive 

and coal. Some Council members estimated that the increase in commodity prices 

energy sectors are affected by both demand factors – i.e.  progressive reconstruction 

the global economy after the pandemic crisis – as well as supply constraints 

resulting ",False,No
1899,2021-09-08,,National Bank of Poland,carbon footprint," target in the coming quarters. Part 

members of the Council pointed out that the long-term factor increasing inflation 

climate policy measures that can permanently drive up not only prices 

energy, but also other goods containing the so-called  carbon footprint.  It was pointed out that 

at the same time, that the possible realisation of the risks associated with the pandemic could 

economic growth in the coming quarters, and thus also demand pressure 

on prices. 

Some members of the Council drew atten",True,yes
1899,2021-09-08,,National Bank of Poland,climate policy,"months.  In their view, the risk that inflation will not be able to 

will return to the range of deviations from the inflation target in the coming quarters. Part 

members of the Council pointed out that the long-term factor increasing inflation 

climate policy measures that can permanently drive up not only prices 

energy, but also other goods containing the so-called  carbon footprint.  It was pointed out that 

at the same time, that the possible realisation of the risks associated with the pandemic co",True,yes
1903,2021-04-07,,National Bank of Poland,climate policy,"point to a decrease in inflation 
in 2022 to a level close to 2.5%. These members indicated that in other cases they had also 
countries should be expected to increase inflation in the near future.  

Some members of the Council argued that the EU's climate policy was mainly 
European Union, resulting in m.in.  a significant increase in the prices of CO2 emission allowances, may 
higher energy prices also in 2022 and thus have a more sustainable impact on the 
impact on the development of the CPI index in Pol",True,yes
1905,2021-02-03,,National Bank of Poland,climate policy,"tion, counteracting the 
excessive increase in the supply of this raw material, which also translates into higher prices. 
It was pointed out that in the long run, global oil supply could be affected by the 
On the one hand, the likely change in the climate policy of the United States and, on the other hand, 
or the lifting of sanctions against certain 
on the other hand, the possible relaxation of the 
producers of this raw material.  

The Council members stressed that the main central banks continue to str",False,No
1918,2020-01-08,,National Bank of Poland,climate policy,"9  2020  will be mainly due to the impact of the 
beyond the influence of national monetary policy, including the actions taken by the 
regulatory and supply shocks. The factors increasing inflation will be 
higher electricity prices (related m.in.  climate policy) and more expensive 
fuel (related to higher global oil prices). Towards the transitional 

2/4 

444444444444444

444444444444444

444444444444444

higher inflation may also be affected by the projected increases in garbage collection fees 
and an ",False,No
1929,2019-01-09,,National Bank of Poland,coal," markets – due to the structure of the fuel market in Poland – may not fully 

2/4 

444444444444444

444444444444444

444444444444444

domestic fuel prices. Some members of the Council also pointed to the fact that 
higher than in previous quarters coal prices as a factor that may increase costs 
maintenance of households this year.  Taking into account all the information that 
since the previous Council meeting, it was assessed that inflation in 2019 could be 
significantly lower than previously ",False,No
1931,2018-11-07,,National Bank of Poland,carbon dioxide," was emphasized that the projected increase in inflation in 2019 would be due to 
mainly assumed significant increase in energy prices for households related to the 
relatively high prices of energy resources in the world, as well as more expensive 
carbon dioxide emission allowances and higher prices of the so-called  Colored 
Certificates. Conducive to higher energy prices may also be the introduction of 
from next year, the emission fee on fuels. On the other hand, core inflation is expected to 
– to grow ",False,No
1932,2018-10-03,,National Bank of Poland,carbon dioxide,"f of 2019 will be higher than it is now. Members 
The Councils pointed out that the increase in inflation will mainly be driven by higher energy prices related to the 
higher prices of energy resources, as well as more expensive emission allowances 
carbon dioxide. According to some Council members, the increase in fuel prices may be 
The introduction of an emission fee from next year will also have an impact.  Extra 
A factor conducive to higher inflation will also be the expected higher 
annual dynamics of ",True,yes
